{
  "$schema": "http://json-schema.org/draft-07/schema#",
  "$id": "hajjPackage.json",
  "title": "Package",
  "description": "Hajj package details",
  "type": "object",
  "properties": {
    "company":{
    "description": "company name",
    "type": "string"
    },
    "url":{
      "description": "url to package details",
      "type": "string",
      "format": "uri"
    },
    "ppp" : {
      "description": "price per person in £", 
      "type": ["integer", "null"],
      "minimum": 2000,
      "maximum": 25000,
      "minItems": 1
      },
    "year":{
      "description": "year in which package is offered",
      "type": ["integer", "null"],
      "minimum": 2020
    },
    "total_days":{
      "description": "total number of days in package",
      "type": ["integer", "null"],
      "minimum": 10,
      "maximum": 30
    },
    "tier":{
      "description": "type of hajj package: luxury, premium, or economy",
      "type": ["string", "null"],
      "enum": ["luxury", "premium", "economy", null]
    },
    "stars":{
      "description": "star rating (1-5)",
      "type": ["integer", "null"],
      "minimum": 1,
      "maximum": 5
    },
    "is_shifting":{
      "description": "True if shifting package, False if non shifting",
      "type": ["boolean", "null"]
    },
    "departure_city":{
      "description": "The deparature city where the umrah is being offered from.",
      "type": ["string", "null"]
    },
    "is_visa_included":{
      "description": "True if visa included in package, False if visa not included",
      "type": ["boolean", "null"]
    },

    "makkah_hotel": {
      "description": "Makkah hotel details",
      "$ref": "hotel.json"
    },
    "madinah_hotel":{
      "description": "Madinah hotel details",
      "$ref": "hotel.json"
    }
  },
  "required": ["company","ppp", "year", "total_days", "stars", "is_shifting", "departure_city", "is_visa_included", "makkah_hotel", "madinah_hotel"]
}