{
    "url": "https://umrah-alamanah.com/hajj-packages-2026/",
    "company": "umrah-alamanah",
    "ppp": 9250,
    "year": 2027,
    "total_days": 17,
    "tier": "economy",
    "stars": 5,
    "departure_city": null,
    "is_visa_included": true,
    "is_shifting": false,
    "makkah_hotel": {
        "total_days": 6,
        "name": null,
        "images": null,
        "stars": 5,
        "has_wifi": false,
        "has_ac": false,
        "distance_to_haram": 634,
        "walk_to_haram": null,
        "number_of_beds": null
    },
    "madinah_hotel": {
        "total_days": 3,
        "name": null,
        "images": null,
        "stars": 5,
        "has_wifi": false,
        "has_ac": true,
        "distance_to_haram": null,
        "walk_to_haram": null,
        "number_of_beds": null
    }
}