{
    "url": "https://www.linkedin.com/checkpoint/lg/login?session_redirect=https%3A%2F%2Fwww%2Elinkedin%2Ecom%2FshareArticle%3Fmini%3Dtrue%26url%3Dhttps%3A%2F%2Fduatravels%2Eco%2Euk%2Fa-brief-guide-to-hajj-and-hajj-packages%2F%26title%3DA%2BBrief%2BGuide%2Bto%2BHajj%2Band%2BHajj%2BPackages%2B2026&fromSignIn=true&trk=reset_password",
    "company": "duatravels",
    "ppp": null,
    "year": null,
    "total_days": null,
    "tier": null,
    "stars": null,
    "departure_city": null,
    "is_visa_included": false,
    "is_shifting": false,
    "makkah_hotel": null,
    "madinah_hotel": null
}