{
    "url": "https://alhayatourstravel.com/india-hajj-packages/",
    "company": "alhayatourstravel",
    "ppp": null,
    "year": 2026,
    "total_days": null,
    "tier": null,
    "stars": null,
    "departure_city": null,
    "is_visa_included": false,
    "is_shifting": false,
    "makkah_hotel": null,
    "madinah_hotel": null
}