{
    "url": "https://sarainternationaltravel.com/nusuk-hajj-packages-for-france/",
    "company": "sarainternationaltravel",
    "ppp": 8170,
    "year": 2027,
    "total_days": null,
    "tier": null,
    "stars": 5,
    "departure_city": null,
    "is_visa_included": true,
    "is_shifting": null,
    "makkah_hotel": {
        "total_days": null,
        "name": null,
        "images": null,
        "stars": null,
        "has_wifi": false,
        "has_ac": false,
        "distance_to_haram": null,
        "walk_to_haram": null,
        "number_of_beds": null
    },
    "madinah_hotel": {
        "total_days": null,
        "name": null,
        "images": null,
        "stars": null,
        "has_wifi": false,
        "has_ac": false,
        "distance_to_haram": null,
        "walk_to_haram": null,
        "number_of_beds": null
    }
}
