{
    "url": "https://www.makkahtour.co.uk/blogs/get-the-cheapest-hajj-and-umrah-packages-from-uk-best-umrah-travel-agency/",
    "company": "makkahtour",
    "ppp": null,
    "year": null,
    "total_days": null,
    "tier": null,
    "stars": null,
    "departure_city": null,
    "is_visa_included": false,
    "is_shifting": true,
    "makkah_hotel": {
        "total_days": null,
        "name": null,
        "images": null,
        "stars": null,
        "has_wifi": false,
        "has_ac": false,
        "distance_to_haram": null,
        "walk_to_haram": null,
        "number_of_beds": null
    },
    "madinah_hotel": null
}