{
    "url": "https://www.hajjumrahhub.co.uk/hajj/2-3-weeks-non-shifting-hajj-package.html",
    "company": "hajjumrahhub",
    "ppp": 6999,
    "year": null,
    "total_days": null,
    "tier": null,
    "stars": 3,
    "departure_city": "Belfast",
    "is_visa_included": true,
    "is_shifting": false,
    "makkah_hotel": {
        "total_days": null,
        "name": null,
        "images": [
            "https://www.hajjumrahhub.co.uk/media/hotel/Al%20Saher%20Hotel1.jpg",
            "https://www.hajjumrahhub.co.uk/media/hotel/Al%20Saher%20Hotel8.jpg",
            "https://www.hajjumrahhub.co.uk/media/hotel/Al%20Saher%20Hotel14.jpg",
            "https://www.hajjumrahhub.co.uk/media/hotel/Al%20Saher%20Hotel3.jpg",
            "https://www.hajjumrahhub.co.uk/media/hotel/Al%20Saher%20Hotel4.jpg",
            "https://www.hajjumrahhub.co.uk/media/hotel/Al%20Saher%20Hotel13.jpg",
            "https://www.hajjumrahhub.co.uk/media/hotel/Al%20Saher%20Hotel6.jpg",
            "https://www.hajjumrahhub.co.uk/media/hotel/Al%20Saher%20Hotel12.jpg",
            "https://www.hajjumrahhub.co.uk/media/hotel/Al%20Saher%20Hotel11.jpg",
            "https://www.hajjumrahhub.co.uk/media/hotel/Al%20Saher%20Hotel5.jpg",
            "https://www.hajjumrahhub.co.uk/media/hotel/Al%20Saher%20Hotel10.jpg",
            "https://www.hajjumrahhub.co.uk/media/hotel/Al%20Saher%20Hotel2.jpg",
            "https://www.hajjumrahhub.co.uk/media/hotel/Al%20Saher%20Hotel9.jpg",
            "https://www.hajjumrahhub.co.uk/media/hotel/Al%20Saher%20Hotel.jpg",
            "https://www.hajjumrahhub.co.uk/media/hotel/Al%20Saher%20Hotel7.jpg"
        ],
        "stars": null,
        "has_wifi": true,
        "has_ac": true,
        "distance_to_haram": null,
        "walk_to_haram": null,
        "number_of_beds": null
    },
    "madinah_hotel": {
        "total_days": null,
        "name": "Saja Al Madinah Hotel",
        "images": [
            "https://www.hajjumrahhub.co.uk/media/hotel/Saja%20AlMadinah%20Hotel3.jpg",
            "https://www.hajjumrahhub.co.uk/media/hotel/Saja%20AlMadinah%20Hotel4.jpg",
            "https://www.hajjumrahhub.co.uk/media/hotel/Saja%20AlMadinah%20Hotel6.jpg",
            "https://www.hajjumrahhub.co.uk/media/hotel/Saja%20AlMadinah%20Hotel9.jpg",
            "https://www.hajjumrahhub.co.uk/media/hotel/Saja%20AlMadinah%20Hotel7.jpg",
            "https://www.hajjumrahhub.co.uk/media/hotel/Saja%20AlMadinah%20Hotel12.jpg",
            "https://www.hajjumrahhub.co.uk/media/hotel/Saja%20AlMadinah%20Hotel8.jpg",
            "https://www.hajjumrahhub.co.uk/media/hotel/Saja%20AlMadinah%20Hotel10.jpg",
            "https://www.hajjumrahhub.co.uk/media/hotel/Saja%20AlMadinah%20Hotel17.jpg",
            "https://www.hajjumrahhub.co.uk/media/hotel/Saja%20AlMadinah%20Hotel1.jpg",
            "https://www.hajjumrahhub.co.uk/media/hotel/Saja%20AlMadinah%20Hotel5.jpg",
            "https://www.hajjumrahhub.co.uk/media/hotel/Saja%20AlMadinah%20Hotel13.jpg",
            "https://www.hajjumrahhub.co.uk/media/hotel/Saja%20AlMadinah%20Hotel14.jpg",
            "https://www.hajjumrahhub.co.uk/media/hotel/Saja%20AlMadinah%20Hotel15.jpg",
            "https://www.hajjumrahhub.co.uk/media/hotel/Saja%20AlMadinah%20Hotel16.jpg",
            "https://www.hajjumrahhub.co.uk/media/hotel/Saja%20AlMadinah%20Hotel.jpg",
            "https://www.hajjumrahhub.co.uk/media/hotel/Saja%20AlMadinah%20Hotel11.jpg",
            "https://www.hajjumrahhub.co.uk/media/hotel/Saja%20AlMadinah%20Hotel2.jpg"
        ],
        "stars": null,
        "has_wifi": true,
        "has_ac": false,
        "distance_to_haram": null,
        "walk_to_haram": 3,
        "number_of_beds": null
    }
}