{
    "url": "https://www.makkahtour.co.uk/blogs/get-the-cheapest-hajj-and-umrah-packages-from-uk-best-umrah-travel-agency/",
    "company": "makkahtour",
    "ppp": null,
    "year": null,
    "total_days": null,
    "tier": null,
    "stars": null,
    "departure_city": null,
    "is_visa_included": false,
    "is_shifting": null,
    "makkah_hotel": null,
    "madinah_hotel": null
}
