{
    "url": "https://www.islamictravel.co.uk/hajj/4-weeks-hajj-package-non-shifting.html",
    "company": "islamictravel",
    "ppp": 7195,
    "year": 2027,
    "total_days": 21,
    "tier": null,
    "stars": 3,
    "departure_city": "London Heathrow",
    "is_visa_included": true,
    "is_shifting": false,
    "makkah_hotel": {
        "total_days": 9,
        "name": "Dar Al-Sultan Hotel",
        "images": [
            "https://www.islamictravel.co.uk/media/hotel/Dar%20Al%20Sultan13.jpg",
            "https://www.islamictravel.co.uk/media/hotel/Dar%20Al%20Sultan1.jpg",
            "https://www.islamictravel.co.uk/media/hotel/Dar%20Al%20Sultan5.jpg",
            "https://www.islamictravel.co.uk/media/hotel/Dar%20Al%20Sultan8.jpg",
            "https://www.islamictravel.co.uk/media/hotel/Dar%20Al%20Sultan.jpg",
            "https://www.islamictravel.co.uk/media/hotel/Dar%20Al%20Sultan3.jpg",
            "https://www.islamictravel.co.uk/media/hotel/Dar%20Al%20Sultan2.jpg",
            "https://www.islamictravel.co.uk/media/hotel/Dar%20Al%20Sultan14.jpg",
            "https://www.islamictravel.co.uk/media/hotel/Dar%20Al%20Sultan16.jpg",
            "https://www.islamictravel.co.uk/media/hotel/Dar%20Al%20Sultan7.jpg",
            "https://www.islamictravel.co.uk/media/hotel/Dar%20Al%20Sultan10.jpg",
            "https://www.islamictravel.co.uk/media/hotel/Dar%20Al%20Sultan15.jpg",
            "https://www.islamictravel.co.uk/media/hotel/Dar%20Al%20Sultan4.jpg",
            "https://www.islamictravel.co.uk/media/hotel/Dar%20Al%20Sultan17.jpg",
            "https://www.islamictravel.co.uk/media/hotel/Dar%20Al%20Sultan18.jpg",
            "https://www.islamictravel.co.uk/media/hotel/Dar%20Al%20Sultan12.jpg",
            "https://www.islamictravel.co.uk/media/hotel/Dar%20Al%20Sultan6.jpg",
            "https://www.islamictravel.co.uk/media/hotel/Dar%20Al%20Sultan9.jpg"
        ],
        "stars": null,
        "has_wifi": false,
        "has_ac": false,
        "distance_to_haram": null,
        "walk_to_haram": null,
        "number_of_beds": null
    },
    "madinah_hotel": {
        "total_days": 5,
        "name": "Al Safwa Tower Hotel",
        "images": [
            "https://www.islamictravel.co.uk/media/hotel/Al%20Safwa%20Tower5.jpg",
            "https://www.islamictravel.co.uk/media/hotel/Al%20Safwa%20Tower14.jpg",
            "https://www.islamictravel.co.uk/media/hotel/Al%20Safwa%20Tower3.jpg",
            "https://www.islamictravel.co.uk/media/hotel/Al%20Safwa%20Tower12.jpg",
            "https://www.islamictravel.co.uk/media/hotel/Al%20Safwa%20Tower7.jpg",
            "https://www.islamictravel.co.uk/media/hotel/Al%20Safwa%20Tower16.jpg",
            "https://www.islamictravel.co.uk/media/hotel/Al%20Safwa%20Tower.jpg",
            "https://www.islamictravel.co.uk/media/hotel/Al%20Safwa%20Tower2.jpg",
            "https://www.islamictravel.co.uk/media/hotel/Al%20Safwa%20Tower4.jpg",
            "https://www.islamictravel.co.uk/media/hotel/Al%20Safwa%20Tower6.jpg",
            "https://www.islamictravel.co.uk/media/hotel/Al%20Safwa%20Tower11.jpg",
            "https://www.islamictravel.co.uk/media/hotel/Al%20Safwa%20Tower1.jpg",
            "https://www.islamictravel.co.uk/media/hotel/Al%20Safwa%20Tower8.jpg",
            "https://www.islamictravel.co.uk/media/hotel/Al%20Safwa%20Tower15.jpg",
            "https://www.islamictravel.co.uk/media/hotel/Al%20Safwa%20Tower10.jpg",
            "https://www.islamictravel.co.uk/media/hotel/Al%20Safwa%20Tower9.jpg"
        ],
        "stars": null,
        "has_wifi": false,
        "has_ac": false,
        "distance_to_haram": null,
        "walk_to_haram": null,
        "number_of_beds": null
    }
}
