{
    "url": "https://hajitours.com/package-category/hajj-packages/",
    "company": "hajitours",
    "ppp": null,
    "year": null,
    "total_days": null,
    "tier": null,
    "stars": null,
    "departure_city": null,
    "is_visa_included": false,
    "is_shifting": false,
    "makkah_hotel": null,
    "madinah_hotel": null
}