{
    "url": "https://alamanahtravel.co.uk/27-days-economy-hajj-package/",
    "company": "alamanahtravel",
    "ppp": 4700,
    "year": 2026,
    "total_days": 27,
    "tier": "economy",
    "stars": null,
    "departure_city": null,
    "is_visa_included": true,
    "is_shifting": true,
    "makkah_hotel": {
        "total_days": 10,
        "name": "Wahet Al Deafah Hotel",
        "images": [
            "http://alamanahtravel.co.uk/wp-content/uploads/2025/09/Wahet-Al-Deafah-Hotel-1.webp",
            "http://alamanahtravel.co.uk/wp-content/uploads/2025/09/Wahet-Al-Deafah-Hotel-room-1.webp"
        ],
        "stars": null,
        "has_wifi": true,
        "has_ac": true,
        "distance_to_haram": null,
        "walk_to_haram": null,
        "number_of_beds": null
    },
    "madinah_hotel": {
        "total_days": 17,
        "name": "Manazil Al Aswaf",
        "images": [
            "http://alamanahtravel.co.uk/wp-content/uploads/2025/09/Manazel-Alaswaf-Hotel-2.webp",
            "http://alamanahtravel.co.uk/wp-content/uploads/2025/09/Manazel-Alaswaf-3.webp"
        ],
        "stars": null,
        "has_wifi": true,
        "has_ac": false,
        "distance_to_haram": null,
        "walk_to_haram": 5,
        "number_of_beds": null
    }
}
